Tweet Id,Text,Name,Screen Name,UTC,Created At,Favorites,Retweets,Language,Client,Tweet Type,URLs,Hashtags,Mentions,Media Type,Media URLs
1541774785893605381,@LilNasX https://t.co/kXF5ukvuIe,J. Cole is listening to,jcoleplaylist,2022-06-28T13:25:28.000Z,Tue Jun 28 13:25:28 +0000 2022,8,0,qme,"<a href=""http://twitter.com/download/iphone"" rel=""nofollow"">Twitter for iPhone</a>",Reply,,0,1,photo,https://pbs.twimg.com/media/FWV7_qWWQA0Va47.jpg
1541526826232709121,J. Cole is listening to Block Me by Dende https://t.co/vDW2kGJ42N,J. Cole is listening to,jcoleplaylist,2022-06-27T21:00:10.000Z,Mon Jun 27 21:00:10 +0000 2022,49,16,en,"<a href=""http://twitter.com/download/iphone"" rel=""nofollow"">Twitter for iPhone</a>",Tweet,,0,0,photo,https://pbs.twimg.com/media/FWSaePqXkAEXA0d.jpg
1541503170572058628,J. Cole is listening to Thoughts from a Balcony by Mac Miller https://t.co/nfTnmp0aXt,J. Cole is listening to,jcoleplaylist,2022-06-27T19:26:10.000Z,Mon Jun 27 19:26:10 +0000 2022,241,13,en,"<a href=""http://twitter.com/download/iphone"" rel=""nofollow"">Twitter for iPhone</a>",Tweet,,0,0,photo,https://pbs.twimg.com/media/FWSE9XbWAAIv7ID.jpg
1541459253600440320,J. Cole is listening to Turn on Me by Future https://t.co/MYZdQBuZnn,J. Cole is listening to,jcoleplaylist,2022-06-27T16:31:39.000Z,Mon Jun 27 16:31:39 +0000 2022,153,10,en,"<a href=""http://twitter.com/download/iphone"" rel=""nofollow"">Twitter for iPhone</a>",Tweet,,0,0,photo,https://pbs.twimg.com/media/FWRdBRBWYAM8X1t.jpg
1541152668126744579,@GeorgeGreavez https://t.co/y2ihqEgmQY,J. Cole is listening to,jcoleplaylist,2022-06-26T20:13:23.000Z,Sun Jun 26 20:13:23 +0000 2022,13,1,qme,"<a href=""http://twitter.com/download/iphone"" rel=""nofollow"">Twitter for iPhone</a>",Reply,,0,1,photo,https://pbs.twimg.com/media/FWNGLhrWYAEiWi9.jpg
1541139706309738496,J. Cole is listening to Cinema by Harry Styles https://t.co/OEePWBmtqb,J. Cole is listening to,jcoleplaylist,2022-06-26T19:21:53.000Z,Sun Jun 26 19:21:53 +0000 2022,231,27,en,"<a href=""http://twitter.com/download/iphone"" rel=""nofollow"">Twitter for iPhone</a>",Tweet,,0,0,photo,https://pbs.twimg.com/media/FWM6Y-7XgAAHX1R.jpg
1541089814778347521,J. Cole is listening to Cilvia Demo by Isaiah Rashad https://t.co/aZagZCLS2D,J. Cole is listening to,jcoleplaylist,2022-06-26T16:03:38.000Z,Sun Jun 26 16:03:38 +0000 2022,1170,103,en,"<a href=""http://twitter.com/download/iphone"" rel=""nofollow"">Twitter for iPhone</a>",Tweet,,0,0,photo,https://pbs.twimg.com/media/FWMNA0lXgAcpLnc.jpg
1540871214716948480,J. Cole is listening to Come Back To Earth by Mac Miller https://t.co/OjbWsi08ny,J. Cole is listening to,jcoleplaylist,2022-06-26T01:35:00.000Z,Sun Jun 26 01:35:00 +0000 2022,2904,233,en,"<a href=""https://about.twitter.com/products/tweetdeck"" rel=""nofollow"">TweetDeck</a>",Tweet,,0,0,photo,https://pbs.twimg.com/media/FWEYgd2XEAELM0Y.jpg
1540852591910801414,J. Cole is listening to Garden (Say It Like That) by SZA https://t.co/EeLFR0p86n,J. Cole is listening to,jcoleplaylist,2022-06-26T00:21:00.000Z,Sun Jun 26 00:21:00 +0000 2022,133,9,en,"<a href=""https://about.twitter.com/products/tweetdeck"" rel=""nofollow"">TweetDeck</a>",Tweet,,0,0,photo,https://pbs.twimg.com/media/FWEYLfjX0AAZ0MM.jpg
1540840260581543937,J. Cole is listening to Lost in Yesterday by Tame Impala https://t.co/BhFwQrOLqJ,J. Cole is listening to,jcoleplaylist,2022-06-25T23:32:00.000Z,Sat Jun 25 23:32:00 +0000 2022,66,3,en,"<a href=""https://about.twitter.com/products/tweetdeck"" rel=""nofollow"">TweetDeck</a>",Tweet,,0,0,photo,https://pbs.twimg.com/media/FWEX9MgXoAUj1mv.jpg
1540823147955494914,J. Cole is listening to Circles by Post Malone https://t.co/vYLCpuKq9I,J. Cole is listening to,jcoleplaylist,2022-06-25T22:24:00.000Z,Sat Jun 25 22:24:00 +0000 2022,129,14,en,"<a href=""https://about.twitter.com/products/tweetdeck"" rel=""nofollow"">TweetDeck</a>",Tweet,,0,0,photo,https://pbs.twimg.com/media/FWEXuShWYAsIYAx.jpg
1540809810232360971,J. Cole is listening to Axel F by Crazy Frog https://t.co/CVKxOBRHDK,J. Cole is listening to,jcoleplaylist,2022-06-25T21:31:00.000Z,Sat Jun 25 21:31:00 +0000 2022,299,20,en,"<a href=""https://about.twitter.com/products/tweetdeck"" rel=""nofollow"">TweetDeck</a>",Tweet,,0,0,photo,https://pbs.twimg.com/media/FWEXeEzXgAEytmI.jpg
1540793703928778752,J. Cole is listening to Swimming Pools by Kendrick Lamar https://t.co/oZ1Dukwc8u,J. Cole is listening to,jcoleplaylist,2022-06-25T20:27:00.000Z,Sat Jun 25 20:27:00 +0000 2022,1503,91,en,"<a href=""https://about.twitter.com/products/tweetdeck"" rel=""nofollow"">TweetDeck</a>",Tweet,,0,0,photo,https://pbs.twimg.com/media/FWEXJggWIBIlkXF.jpg
1540787816225030147,J. Cole is listening to HEIGHTS by K.$. The Kid &amp; Dre Wave$ https://t.co/pJTaoJIRQZ,J. Cole is listening to,jcoleplaylist,2022-06-25T20:03:36.000Z,Sat Jun 25 20:03:36 +0000 2022,86,9,en,"<a href=""http://twitter.com/download/iphone"" rel=""nofollow"">Twitter for iPhone</a>",Tweet,,0,0,photo,https://pbs.twimg.com/media/FWH6V85WYAAhWCf.jpg
1540780617868070914,J. Cole is listening to NONCHALANT by WESTSIDE BOOGIE &amp; Mamii https://t.co/gdcx3z8zA8,J. Cole is listening to,jcoleplaylist,2022-06-25T19:35:00.000Z,Sat Jun 25 19:35:00 +0000 2022,70,9,en,"<a href=""https://about.twitter.com/products/tweetdeck"" rel=""nofollow"">TweetDeck</a>",Tweet,,0,0,photo,https://pbs.twimg.com/media/FWEWqRsXwAQt6Zo.jpg
1540768538159239170,J. Cole is listening to I Couldn’t Be More In Love by The 1975 https://t.co/iCzFRyefZh,J. Cole is listening to,jcoleplaylist,2022-06-25T18:47:00.000Z,Sat Jun 25 18:47:00 +0000 2022,47,3,en,"<a href=""https://about.twitter.com/products/tweetdeck"" rel=""nofollow"">TweetDeck</a>",Tweet,,0,0,photo,https://pbs.twimg.com/media/FWEWVU3XkAEWgyR.jpg
1540762366958354434,@lildurk J. Cole is listening to your album Durk https://t.co/GgLaiH2wCU,J. Cole is listening to,jcoleplaylist,2022-06-25T18:22:28.000Z,Sat Jun 25 18:22:28 +0000 2022,30,2,en,"<a href=""http://twitter.com/download/iphone"" rel=""nofollow"">Twitter for iPhone</a>",Reply,,0,1,photo,https://pbs.twimg.com/media/FWHjMzGUAAAzObA.jpg
1540748405345079296,J. Cole is listening to Devil In A New Dress by Kanye West &amp; Rick Ross https://t.co/961MXojIFG,J. Cole is listening to,jcoleplaylist,2022-06-25T17:27:00.000Z,Sat Jun 25 17:27:00 +0000 2022,1513,130,en,"<a href=""https://about.twitter.com/products/tweetdeck"" rel=""nofollow"">TweetDeck</a>",Tweet,,0,0,photo,https://pbs.twimg.com/media/FWEV70UXwAA-_Av.jpg
1540747213931876352,@RIRIVOGUEE Love it,J. Cole is listening to,jcoleplaylist,2022-06-25T17:22:16.000Z,Sat Jun 25 17:22:16 +0000 2022,0,0,en,"<a href=""http://twitter.com/download/iphone"" rel=""nofollow"">Twitter for iPhone</a>",Reply,,0,1,,
1540746057704804352,@chanelgodfather @kanyestreams1 @KanyePodcast @PhotosOfKanye @KanyeUpdated @kanyewest My fault Christian,J. Cole is listening to,jcoleplaylist,2022-06-25T17:17:40.000Z,Sat Jun 25 17:17:40 +0000 2022,5,0,en,"<a href=""http://twitter.com/download/iphone"" rel=""nofollow"">Twitter for iPhone</a>",Reply,,0,6,,
1540737584128610307,J. Cole is listening to the Shrek 2 soundtrack https://t.co/V5gbDxGOVl,J. Cole is listening to,jcoleplaylist,2022-06-25T16:44:00.000Z,Sat Jun 25 16:44:00 +0000 2022,2994,261,en,"<a href=""https://about.twitter.com/products/tweetdeck"" rel=""nofollow"">TweetDeck</a>",Tweet,,0,0,photo,https://pbs.twimg.com/media/FWEVoC_WYAA8bmv.jpg
1540727518088536064,J. Cole is listening to MOSHPIT by Baby Keem https://t.co/t3VtDDypJv,J. Cole is listening to,jcoleplaylist,2022-06-25T16:04:00.000Z,Sat Jun 25 16:04:00 +0000 2022,250,18,en,"<a href=""https://about.twitter.com/products/tweetdeck"" rel=""nofollow"">TweetDeck</a>",Tweet,,0,0,photo,https://pbs.twimg.com/media/FWEVUmrWIAACXvA.jpg
1540714683342225409,"J. Cole is listening to RISE! by Tyler, The Creator &amp; Daisy World https://t.co/uPWT1cIRlf",J. Cole is listening to,jcoleplaylist,2022-06-25T15:13:00.000Z,Sat Jun 25 15:13:00 +0000 2022,122,12,en,"<a href=""https://about.twitter.com/products/tweetdeck"" rel=""nofollow"">TweetDeck</a>",Tweet,,0,0,photo,https://pbs.twimg.com/media/FWEU-r0WIAAz7f_.jpg
1540701345534967808,J. Cole is listening to HiiiPower by Kendrick Lamar https://t.co/y0RqVqhGef,J. Cole is listening to,jcoleplaylist,2022-06-25T14:20:00.000Z,Sat Jun 25 14:20:00 +0000 2022,1262,82,en,"<a href=""https://about.twitter.com/products/tweetdeck"" rel=""nofollow"">TweetDeck</a>",Tweet,,0,0,photo,https://pbs.twimg.com/media/FWEUwPMWQAE_Bap.jpg
1540695788438691842,J. Cole is listening to I Don’t See Why by Satomaa https://t.co/MeaRz2bNkc,J. Cole is listening to,jcoleplaylist,2022-06-25T13:57:55.000Z,Sat Jun 25 13:57:55 +0000 2022,72,10,en,"<a href=""http://twitter.com/download/iphone"" rel=""nofollow"">Twitter for iPhone</a>",Tweet,,0,0,photo,https://pbs.twimg.com/media/FWGmpg9XkAAU6QC.jpg
1540690318554583042,@yvngsyrup thanks,J. Cole is listening to,jcoleplaylist,2022-06-25T13:36:11.000Z,Sat Jun 25 13:36:11 +0000 2022,11,0,en,"<a href=""http://twitter.com/download/iphone"" rel=""nofollow"">Twitter for iPhone</a>",Reply,,0,1,,
1540688007405064193,J. Cole is listening to Can I Holla At Ya by J. Cole https://t.co/pZXzJNfEOl,J. Cole is listening to,jcoleplaylist,2022-06-25T13:27:00.000Z,Sat Jun 25 13:27:00 +0000 2022,610,70,en,"<a href=""https://about.twitter.com/products/tweetdeck"" rel=""nofollow"">TweetDeck</a>",Tweet,,0,0,photo,https://pbs.twimg.com/media/FWEUbd0WQAAD2l1.jpg
1540675424446980096,J. Cole is listening to When Sparks Fly by Vince Staples https://t.co/YE6T9HfTr7,J. Cole is listening to,jcoleplaylist,2022-06-25T12:37:00.000Z,Sat Jun 25 12:37:00 +0000 2022,105,7,en,"<a href=""https://about.twitter.com/products/tweetdeck"" rel=""nofollow"">TweetDeck</a>",Tweet,,0,0,photo,https://pbs.twimg.com/media/FWEUEBlWIAE1qvS.jpg
1540532268992708610,J. Cole is listening to pg baby by redveil https://t.co/pJWnuU916p,J. Cole is listening to,jcoleplaylist,2022-06-25T03:08:09.000Z,Sat Jun 25 03:08:09 +0000 2022,242,22,en,"<a href=""http://twitter.com/download/iphone"" rel=""nofollow"">Twitter for iPhone</a>",Tweet,,0,0,photo,https://pbs.twimg.com/media/FWER7hBWQAEAfL-.jpg
1540517301648330752,J. Cole is listening to All My Children by Deante’ Hitchcock https://t.co/5EMDpzIyDJ,J. Cole is listening to,jcoleplaylist,2022-06-25T02:08:40.000Z,Sat Jun 25 02:08:40 +0000 2022,193,19,en,"<a href=""http://twitter.com/download/iphone"" rel=""nofollow"">Twitter for iPhone</a>",Tweet,,0,0,photo,https://pbs.twimg.com/media/FWEEUMAXgAEmrFs.jpg
1540513305646727169,@KanyePodcast 🖤,J. Cole is listening to,jcoleplaylist,2022-06-25T01:52:48.000Z,Sat Jun 25 01:52:48 +0000 2022,5,0,und,"<a href=""http://twitter.com/download/iphone"" rel=""nofollow"">Twitter for iPhone</a>",Reply,,0,1,,
1540507717713989632,J. Cole is listening to Human Nature by Michael Jackson https://t.co/9EtsOeVahk,J. Cole is listening to,jcoleplaylist,2022-06-25T01:30:35.000Z,Sat Jun 25 01:30:35 +0000 2022,476,57,en,"<a href=""http://twitter.com/download/iphone"" rel=""nofollow"">Twitter for iPhone</a>",Tweet,,0,0,photo,https://pbs.twimg.com/media/FWD7miZWIAMHXtv.jpg
1540473366909538305,J. Cole is listening to MEGAMAN by Cochise https://t.co/9B1bDsr9Fq,J. Cole is listening to,jcoleplaylist,2022-06-24T23:14:05.000Z,Fri Jun 24 23:14:05 +0000 2022,128,12,en,"<a href=""http://twitter.com/download/iphone"" rel=""nofollow"">Twitter for iPhone</a>",Tweet,,0,0,photo,https://pbs.twimg.com/media/FWDcW8qWYAALQvG.jpg
1540472696844288003,@tidimello_x Appreciate you!,J. Cole is listening to,jcoleplaylist,2022-06-24T23:11:26.000Z,Fri Jun 24 23:11:26 +0000 2022,1,1,en,"<a href=""http://twitter.com/download/iphone"" rel=""nofollow"">Twitter for iPhone</a>",Reply,,0,1,,
1540467735368503297,J. Cole is listening to Gang Over Luv by Brent Faiyaz https://t.co/d7uPs9FimZ,J. Cole is listening to,jcoleplaylist,2022-06-24T22:51:43.000Z,Fri Jun 24 22:51:43 +0000 2022,131,29,en,"<a href=""http://twitter.com/download/iphone"" rel=""nofollow"">Twitter for iPhone</a>",Tweet,,0,0,photo,https://pbs.twimg.com/media/FWDXPFJXoAEGGJU.jpg
1540455838850187266,J. Cole is listening to Off The Grid by Kanye West https://t.co/kCK59uspkQ,J. Cole is listening to,jcoleplaylist,2022-06-24T22:04:26.000Z,Fri Jun 24 22:04:26 +0000 2022,7407,395,en,"<a href=""http://twitter.com/download/iphone"" rel=""nofollow"">Twitter for iPhone</a>",Tweet,,0,0,photo,https://pbs.twimg.com/media/FWDMapiWAAA4SZy.jpg
1540449810431483904,J. Cole is listening to Waves by Joey Bada$$ https://t.co/8jMmUBXqKm,J. Cole is listening to,jcoleplaylist,2022-06-24T21:40:29.000Z,Fri Jun 24 21:40:29 +0000 2022,713,64,en,"<a href=""http://twitter.com/download/iphone"" rel=""nofollow"">Twitter for iPhone</a>",Tweet,,0,0,photo,https://pbs.twimg.com/media/FWDG7k8XEAEi4Di.jpg
1540448279082799113,@wiz_thcreator @LilNasX Cool picture you got there,J. Cole is listening to,jcoleplaylist,2022-06-24T21:34:24.000Z,Fri Jun 24 21:34:24 +0000 2022,5,0,en,"<a href=""http://twitter.com/download/iphone"" rel=""nofollow"">Twitter for iPhone</a>",Reply,,0,2,,
1540445862186389504,J. Cole is listening to F**k Love by XXTENTACION &amp; Trippie Redd https://t.co/SeG8iL2bgd,J. Cole is listening to,jcoleplaylist,2022-06-24T21:24:48.000Z,Fri Jun 24 21:24:48 +0000 2022,233,27,en,"<a href=""http://twitter.com/download/iphone"" rel=""nofollow"">Twitter for iPhone</a>",Tweet,,0,0,photo,https://pbs.twimg.com/media/FWDDV1fWYAY7EoA.jpg
1540442555040645120,J. Cole is listening to @casual_thomas new album https://t.co/OM5HTxVGD2,J. Cole is listening to,jcoleplaylist,2022-06-24T21:11:39.000Z,Fri Jun 24 21:11:39 +0000 2022,44,7,en,"<a href=""http://twitter.com/download/iphone"" rel=""nofollow"">Twitter for iPhone</a>",Tweet,,0,1,photo,https://pbs.twimg.com/media/FWDAVM3XoAEkNA1.jpg
1540433787254874112,J. Cole is listening to Parking Lot by Anderson .Paak https://t.co/divAX6r4bW,J. Cole is listening to,jcoleplaylist,2022-06-24T20:36:49.000Z,Fri Jun 24 20:36:49 +0000 2022,722,35,en,"<a href=""http://twitter.com/download/iphone"" rel=""nofollow"">Twitter for iPhone</a>",Tweet,,0,0,photo,https://pbs.twimg.com/media/FWC4XHkXoAEWfO9.jpg
1540428345611018241,"J. Cole is listening to Talk About Me by Dot Da Genius, Kid Cudi, JID &amp; Denzel Curry https://t.co/K8SLRcDJeR",J. Cole is listening to,jcoleplaylist,2022-06-24T20:15:12.000Z,Fri Jun 24 20:15:12 +0000 2022,317,35,en,"<a href=""http://twitter.com/download/iphone"" rel=""nofollow"">Twitter for iPhone</a>",Tweet,,0,0,photo,https://pbs.twimg.com/media/FWCzaWxWIAMVfWC.jpg
1540421806158397441,J. Cole is listening to On the Floor by IceJJFish https://t.co/iwEaFIQH23,J. Cole is listening to,jcoleplaylist,2022-06-24T19:49:12.000Z,Fri Jun 24 19:49:12 +0000 2022,160,19,en,"<a href=""http://twitter.com/download/iphone"" rel=""nofollow"">Twitter for iPhone</a>",Tweet,,0,0,photo,https://pbs.twimg.com/media/FWCtdw6XoAA_P48.jpg
1540410963198967809,J. Cole is listening to Sacrifice by The Weeknd https://t.co/IcWbaFKPTC,J. Cole is listening to,jcoleplaylist,2022-06-24T19:06:07.000Z,Fri Jun 24 19:06:07 +0000 2022,2834,227,en,"<a href=""http://twitter.com/download/iphone"" rel=""nofollow"">Twitter for iPhone</a>",Tweet,,0,0,photo,https://pbs.twimg.com/media/FWCjmkIXoAA3wIZ.jpg
1540407987499671553,J. Cole is listening to Birth Right. by @kylemontrel https://t.co/jGRQtC0XRR,J. Cole is listening to,jcoleplaylist,2022-06-24T18:54:18.000Z,Fri Jun 24 18:54:18 +0000 2022,66,8,en,"<a href=""http://twitter.com/download/iphone"" rel=""nofollow"">Twitter for iPhone</a>",Tweet,,0,1,photo,https://pbs.twimg.com/media/FWCg5VYXoAc89ab.jpg
1540399216308195328,J. Cole is listening to Wings by Mac Miller https://t.co/fATn6sVgdd,J. Cole is listening to,jcoleplaylist,2022-06-24T18:19:27.000Z,Fri Jun 24 18:19:27 +0000 2022,6300,505,en,"<a href=""http://twitter.com/download/iphone"" rel=""nofollow"">Twitter for iPhone</a>",Tweet,,0,0,photo,https://pbs.twimg.com/media/FWCY6r_WYAI2EY6.jpg
1540390641397645313,J. Cole is listening to White Ferrari by Frank Ocean https://t.co/8ONGZpzSGe,J. Cole is listening to,jcoleplaylist,2022-06-24T17:45:22.000Z,Fri Jun 24 17:45:22 +0000 2022,1963,195,en,"<a href=""http://twitter.com/download/iphone"" rel=""nofollow"">Twitter for iPhone</a>",Tweet,,0,0,photo,https://pbs.twimg.com/media/FWCRHomWIAE_q0I.jpg
1540384213928755201,J. Cole is listening to The Book of Soul by Ab-Soul https://t.co/z6CeXb60XL,J. Cole is listening to,jcoleplaylist,2022-06-24T17:19:50.000Z,Fri Jun 24 17:19:50 +0000 2022,724,64,en,"<a href=""http://twitter.com/download/iphone"" rel=""nofollow"">Twitter for iPhone</a>",Tweet,,0,0,photo,https://pbs.twimg.com/media/FWCLRaGXwAIy2fm.jpg
1540383597932290057,@JoeyCracc82 It says parody in my bio,J. Cole is listening to,jcoleplaylist,2022-06-24T17:17:23.000Z,Fri Jun 24 17:17:23 +0000 2022,33,0,en,"<a href=""http://twitter.com/download/iphone"" rel=""nofollow"">Twitter for iPhone</a>",Reply,,0,1,,
1540377401943031809,J. Cole is listening to No Role Modelz by J. Cole https://t.co/rQYkoMrbAJ,J. Cole is listening to,jcoleplaylist,2022-06-24T16:52:46.000Z,Fri Jun 24 16:52:46 +0000 2022,1061,98,en,"<a href=""http://twitter.com/download/iphone"" rel=""nofollow"">Twitter for iPhone</a>",Tweet,,0,0,photo,https://pbs.twimg.com/media/FWCFFDaWIAAn7kc.jpg
1540367529465548804,J. Cole is listening to Woman by Doja Cat https://t.co/qZeNt57f2T,J. Cole is listening to,jcoleplaylist,2022-06-24T16:13:32.000Z,Fri Jun 24 16:13:32 +0000 2022,240,21,en,"<a href=""http://twitter.com/download/iphone"" rel=""nofollow"">Twitter for iPhone</a>",Tweet,,0,0,photo,https://pbs.twimg.com/media/FWB8F4UXkAE-alI.jpg
1540360775700811778,J. Cole is listening to Zendaya by Chris Patrick https://t.co/028jURkC7R,J. Cole is listening to,jcoleplaylist,2022-06-24T15:46:42.000Z,Fri Jun 24 15:46:42 +0000 2022,259,18,en,"<a href=""http://twitter.com/download/iphone"" rel=""nofollow"">Twitter for iPhone</a>",Tweet,,0,0,photo,https://pbs.twimg.com/media/FWB19PUXwAIa97_.jpg
1540351851689701376,J. Cole is listening to Late To Da Party by Lil Nas X &amp; NBA Youngboy https://t.co/ciRBDffodH,J. Cole is listening to,jcoleplaylist,2022-06-24T15:11:14.000Z,Fri Jun 24 15:11:14 +0000 2022,360,33,en,"<a href=""http://twitter.com/download/iphone"" rel=""nofollow"">Twitter for iPhone</a>",Tweet,,0,0,photo,https://pbs.twimg.com/media/FWBt11EWIAABo53.jpg
1540347930653212674,"@kareem_37 Workin Out, Hereditary and All Bad",J. Cole is listening to,jcoleplaylist,2022-06-24T14:55:39.000Z,Fri Jun 24 14:55:39 +0000 2022,1,0,en,"<a href=""http://twitter.com/download/iphone"" rel=""nofollow"">Twitter for iPhone</a>",Reply,,0,1,,
1540347513647022080,@kareem_37 Top 3 for sure,J. Cole is listening to,jcoleplaylist,2022-06-24T14:54:00.000Z,Fri Jun 24 14:54:00 +0000 2022,1,0,en,"<a href=""http://twitter.com/download/iphone"" rel=""nofollow"">Twitter for iPhone</a>",Reply,,0,1,,
1540345205563465728,@zoeytruu 😂😂😂,J. Cole is listening to,jcoleplaylist,2022-06-24T14:44:49.000Z,Fri Jun 24 14:44:49 +0000 2022,0,0,und,"<a href=""http://twitter.com/download/iphone"" rel=""nofollow"">Twitter for iPhone</a>",Reply,,0,1,,
1540342704219066373,J. Cole is listening to BREAK MY SOUL by Beyoncé https://t.co/16BASBsJCg,J. Cole is listening to,jcoleplaylist,2022-06-24T14:34:53.000Z,Fri Jun 24 14:34:53 +0000 2022,165,21,en,"<a href=""http://twitter.com/download/iphone"" rel=""nofollow"">Twitter for iPhone</a>",Tweet,,0,0,photo,https://pbs.twimg.com/media/FWBlha0XkAUqSHx.jpg
1540334076598550533,J. Cole is listening to Workin Out by JID https://t.co/IkuIMJM3QO,J. Cole is listening to,jcoleplaylist,2022-06-24T14:00:36.000Z,Fri Jun 24 14:00:36 +0000 2022,443,43,en,"<a href=""http://twitter.com/download/iphone"" rel=""nofollow"">Twitter for iPhone</a>",Tweet,,0,0,photo,https://pbs.twimg.com/media/FWBdrL5X0AE_JJ2.jpg
1540330674225283072,J. Cole is listening to Peppa Pig’s debut album https://t.co/xRSexugdnj,J. Cole is listening to,jcoleplaylist,2022-06-24T13:47:05.000Z,Fri Jun 24 13:47:05 +0000 2022,1714,139,en,"<a href=""http://twitter.com/download/iphone"" rel=""nofollow"">Twitter for iPhone</a>",Tweet,,0,0,photo,https://pbs.twimg.com/media/FWBak68XkAEwFse.jpg
1540327894064545793,J. Cole is listening to Count Me Out by Kendrick Lamar https://t.co/mAnynfwHdM,J. Cole is listening to,jcoleplaylist,2022-06-24T13:36:02.000Z,Fri Jun 24 13:36:02 +0000 2022,35840,1609,en,"<a href=""http://twitter.com/download/iphone"" rel=""nofollow"">Twitter for iPhone</a>",Tweet,,0,0,photo,https://pbs.twimg.com/media/FWBYDPkXgAEt7fP.jpg
1540324559311851521,J. Cole is listening to Overdrive by Drake https://t.co/q1rvgOSSBd,J. Cole is listening to,jcoleplaylist,2022-06-24T13:22:47.000Z,Fri Jun 24 13:22:47 +0000 2022,521,29,en,"<a href=""http://twitter.com/download/iphone"" rel=""nofollow"">Twitter for iPhone</a>",Tweet,,0,0,photo,https://pbs.twimg.com/media/FWBVBOFXwAE9Iue.jpg
